{
  "event_id": "e_1",
  "ts": 1,
  "kind": "deliberately_omitted",
  "principle_id": "p_sob",
  "principle_version": 1,
  "repo_id": "r_a",
  "host": "claude_code",
  "session_id": "s",
  "evidence": {
    "finding_id": "f1",
    "user_reason": "already habitual"
  },
  "schema_version": 1,
  "whetstone_version": "0.1",
  "policy_version": "0.1",
  "detector_version": "0.1",
  "model_id": null,
  "mapping_prompt_hash": null,
  "worktree_sha256": "w0"
}